"id","title","description","imageUrl","artist","year","category","tags","userId","galleryId","exhibitionId","createdAt"
"cmpp799ry001etcb8qojd534g","The Storm on the Sea of Galilee","Dramatična scena oluje na moru inspirisana biblijskom pričom o Isusu i apostolima. Rembrandt koristi snažne kontraste svjetlosti i pokreta kako bi pojačao osjećaj haosa i straha.","https://upload.wikimedia.org/wikipedia/commons/f/f3/Rembrandt_Christ_in_the_Storm_on_the_Lake_of_Galilee.jpg","Rembrandt",1633,"Baroque","{storm,sea,dramatic,religious,chaos,baroque}","cmpp4juls0000tczst2one5io",NULL,NULL,"2026-05-28 07:56:52.775"
"cmpp799rz001ftcb8goukdycy","The Tilled Field","Nadrealističko djelo prepuno fantastičnih simbola, životinja i apstraktnih oblika inspirisanih katalonskim selom. Miró kombinuje elemente stvarnosti i mašte kako bi stvorio razigran i gotovo snovit prikaz prirode i života na selu.","https://upload.wikimedia.org/wikipedia/commons/9/9d/The_Tilled_Field.jpg","Joan Miró",1924,"Surrealism","{surreal,landscape,abstract,symbolic,colorful,dreamlike}","cmpp4juls0000tczst2one5io",NULL,NULL,"2026-05-28 07:56:52.775"
"cmpp799s0001gtcb8cmpawcwz","Self-Portrait with Thorn Necklace and Hummingbird","Intiman autoportret u kojem Frida kroz simbole prirode, bola i identiteta prikazuje svoje emocionalno stanje. Trnje oko vrata podsjeća na patnju, dok životinje nose različita simbolička značenja.","https://upload.wikimedia.org/wikipedia/en/1/1e/Frida_Kahlo_%28self_portrait%29.jpg","Frida Kahlo",1940,"Modernism","{pain,identity,symbolic,emotional,modernism,intense}","cmpp4juls0000tczst2one5io",NULL,NULL,"2026-05-28 07:56:52.775"
"cmpp799s0001htcb88pfyaor0","The Gleaners","Realistička scena žena koje skupljaju ostatke žita nakon žetve. Millet kroz jednostavan prizor prikazuje težak život seljaka i dostojanstvo rada.","https://upload.wikimedia.org/wikipedia/commons/8/87/Jean-Fran%C3%A7ois_Millet_-_Gleaners_-_Google_Art_Project.jpg","Jean-François Millet",1857,"Realism","{poverty,work,realism,simple-life,field,calm}","cmpp4juls0000tczst2one5io",NULL,NULL,"2026-05-28 07:56:52.775"
"cmpp799s0001itcb81avm2r07","Broadway Boogie Woogie","Apstraktna kompozicija inspirisana ritmom Njujorka i džez muzikom. Mondrian koristi mrežu linija i jarke blokove boja kako bi dočarao energiju modernog grada.","https://upload.wikimedia.org/wikipedia/commons/3/30/Piet_Mondrian%2C_1942_-_Broadway_Boogie_Woogie.jpg","Piet Mondrian",1943,"Abstract","{abstract,city,rhythm,geometry,modern,color}","cmpp4juls0000tczst2one5io",NULL,NULL,"2026-05-28 07:56:52.775"
"cmpp799s1001jtcb85tkcwqtz","The Bathers","Serija slika koja prikazuje figure u prirodi kroz pojednostavljene oblike i stabilnu kompoziciju. Cézanne istražuje odnos ljudskog tijela i prostora, postavljajući temelje modernoj umjetnosti.","https://upload.wikimedia.org/wikipedia/commons/2/25/Paul_C%C3%A9zanne%2C_French_-_The_Large_Bathers_-_Google_Art_Project.jpg","Paul Cézanne",1905,"Post-Impressionism","{nature,calm,bodies,post-impressionism,quiet,landscape}","cmpp4juls0000tczst2one5io",NULL,NULL,"2026-05-28 07:56:52.775"
"cmpp799s1001ktcb8s8b8w1qd","Blue Nude II","Djelo nastalo tehnikom izrezanog papira koje prikazuje stilizovanu plavu figuru. Matisse kroz jednostavne oblike i snažnu boju postiže osjećaj elegancije i pokreta.","https://upload.wikimedia.org/wikipedia/en/7/78/Blue_Nudes_Henri_Matisse.jpg","Henri Matisse",1952,"Modernism","{abstract,body,color,modernism,minimal,shape}","cmpp4juls0000tczst2one5io",NULL,NULL,"2026-05-28 07:56:52.775"
"cmpp799s2001ltcb87whwkkl6","The School of Athens","Monumentalna renesansna freska koja prikazuje okupljanje velikih filozofa antičkog svijeta poput Platona i Aristotela. Djelo simbolizuje harmoniju znanja, umjetnosti i nauke.","https://upload.wikimedia.org/wikipedia/commons/4/49/%22The_School_of_Athens%22_by_Raffaello_Sanzio_da_Urbino.jpg","Raphael",1511,"Renaissance","{philosophy,knowledge,renaissance,grand,classical,intellectual}","cmpp4juls0000tczst2one5io",NULL,NULL,"2026-05-28 07:56:52.775"
"cmpp799s2001mtcb82ox9fqr8","The Lovers","Nadrealistička slika koja prikazuje dvoje ljudi kako se ljube dok su im lica prekrivena tkaninom. Magritte kroz misterioznu i pomalo uznemirujuću scenu istražuje teme ljubavi, distance i nemogućnosti potpunog razumijevanja druge osobe.","https://upload.wikimedia.org/wikipedia/commons/c/c5/Les_Amants.webp","René Magritte",1928,"Surrealism","{love,mysterious,surreal,intimacy,hidden,emotional}","cmpp4juls0000tczst2one5io",NULL,NULL,"2026-05-28 07:56:52.775"
"cmpp799s3001ntcb8avpz9nwo","The Luncheon on the Grass","Kontroverzno djelo koje prikazuje piknik u prirodi sa potpuno odjevenim muškarcima i nagom ženom, što je izazvalo veliki skandal u tadašnjem društvu. Manet ovim djelom prekida akademske tradicije i postavlja temelje moderne umjetnosti.","https://upload.wikimedia.org/wikipedia/commons/9/90/Edouard_Manet_-_Luncheon_on_the_Grass_-_Google_Art_Project.jpg","Édouard Manet",1863,"Realism","{controversial,outdoor,leisure,realism,light,social}","cmpp4juls0000tczst2one5io",NULL,NULL,"2026-05-28 07:56:52.775"
